[{"name":"Ekans","originalName":"Ekans","form":null,"gender":null,"tier":"1-Star Raids","isShadowRaid":false,"eventStatus":"unknown","canBeShiny":true,"types":[{"name":"poison","image":"https://leekduck.com/assets/img/types/poison.png"}],"combatPower":{"normal":{"min":487,"max":529},"boosted":{"min":609,"max":662}},"boostedWeather":[{"name":"cloudy","image":"https://leekduck.com/assets/img/weather/cloudy.png"}],"image":"https://cdn.leekduck.com/assets/img/pokemon_icons/pm23.icon.png","imageWidth":256,"imageHeight":256,"imageType":"png"},{"name":"Vanillite","originalName":"Vanillite","form":null,"gender":null,"tier":"1-Star Raids","isShadowRaid":false,"eventStatus":"unknown","canBeShiny":true,"types":[{"name":"ice","image":"https://leekduck.com/assets/img/types/ice.png"}],"combatPower":{"normal":{"min":545,"max":590},"boosted":{"min":682,"max":738}},"boostedWeather":[{"name":"snow","image":"https://leekduck.com/assets/img/weather/snowy.png"}],"image":"https://cdn.leekduck.com/assets/img/pokemon_icons/pm582.icon.png","imageWidth":256,"imageHeight":256,"imageType":"png"},{"name":"Honedge","originalName":"Honedge","form":null,"gender":null,"tier":"1-Star Raids","isShadowRaid":false,"eventStatus":"unknown","canBeShiny":false,"types":[{"name":"steel","image":"https://leekduck.com/assets/img/types/steel.png"},{"name":"ghost","image":"https://leekduck.com/assets/img/types/ghost.png"}],"combatPower":{"normal":{"min":742,"max":794},"boosted":{"min":927,"max":993}},"boostedWeather":[{"name":"snow","image":"https://leekduck.com/assets/img/weather/snowy.png"},{"name":"fog","image":"https://leekduck.com/assets/img/weather/foggy.png"}],"image":"https://cdn.leekduck.com/assets/img/pokemon_icons/pm679.icon.png","imageWidth":256,"imageHeight":256,"imageType":"png"},{"name":"Sinistea","originalName":"Sinistea","form":null,"gender":null,"tier":"1-Star Raids","isShadowRaid":false,"eventStatus":"unknown","canBeShiny":true,"types":[{"name":"ghost","image":"https://leekduck.com/assets/img/types/ghost.png"}],"combatPower":{"normal":{"min":603,"max":650},"boosted":{"min":754,"max":813}},"boostedWeather":[{"name":"fog","image":"https://leekduck.com/assets/img/weather/foggy.png"}],"image":"https://cdn.leekduck.com/assets/img/pokemon_icons/pm854.icon.png","imageWidth":256,"imageHeight":256,"imageType":"png"},{"name":"Honchkrow","originalName":"Honchkrow","form":null,"gender":null,"tier":"3-Star Raids","isShadowRaid":false,"eventStatus":"unknown","canBeShiny":false,"types":[{"name":"dark","image":"https://leekduck.com/assets/img/types/dark.png"},{"name":"flying","image":"https://leekduck.com/assets/img/types/flying.png"}],"combatPower":{"normal":{"min":1471,"max":1549},"boosted":{"min":1839,"max":1937}},"boostedWeather":[{"name":"fog","image":"https://leekduck.com/assets/img/weather/foggy.png"},{"name":"windy","image":"https://leekduck.com/assets/img/weather/windy.png"}],"image":"https://cdn.leekduck.com/assets/img/pokemon_icons/pm430.icon.png","imageWidth":256,"imageHeight":256,"imageType":"png"},{"name":"Beartic","originalName":"Beartic","form":null,"gender":null,"tier":"3-Star Raids","isShadowRaid":false,"eventStatus":"unknown","canBeShiny":false,"types":[{"name":"ice","image":"https://leekduck.com/assets/img/types/ice.png"}],"combatPower":{"normal":{"min":1659,"max":1738},"boosted":{"min":2074,"max":2173}},"boostedWeather":[{"name":"snow","image":"https://leekduck.com/assets/img/weather/snowy.png"}],"image":"https://cdn.leekduck.com/assets/img/pokemon_icons/pm614.icon.png","imageWidth":256,"imageHeight":256,"imageType":"png"},{"name":"Bombirdier","originalName":"Bombirdier","form":null,"gender":null,"tier":"3-Star Raids","isShadowRaid":false,"eventStatus":"unknown","canBeShiny":true,"types":[{"name":"flying","image":"https://leekduck.com/assets/img/types/flying.png"},{"name":"dark","image":"https://leekduck.com/assets/img/types/dark.png"}],"combatPower":{"normal":{"min":1351,"max":1421},"boosted":{"min":1688,"max":1777}},"boostedWeather":[{"name":"windy","image":"https://leekduck.com/assets/img/weather/windy.png"},{"name":"fog","image":"https://leekduck.com/assets/img/weather/foggy.png"}],"image":"https://cdn.leekduck.com/assets/img/pokemon_icons/pm962.icon.png","imageWidth":256,"imageHeight":256,"imageType":"png"},{"name":"Tornadus","originalName":"Tornadus (Incarnate)","form":"Incarnate","gender":null,"tier":"5-Star Raids","isShadowRaid":false,"eventStatus":"ongoing","canBeShiny":true,"types":[{"name":"flying","image":"https://leekduck.com/assets/img/types/flying.png"}],"combatPower":{"normal":{"min":1828,"max":1911},"boosted":{"min":2285,"max":2389}},"boostedWeather":[{"name":"windy","image":"https://leekduck.com/assets/img/weather/windy.png"}],"image":"https://cdn.leekduck.com/assets/img/pokemon_icons/pm641.fINCARNATE.icon.png","imageWidth":256,"imageHeight":256,"imageType":"png"},{"name":"Mega Ampharos","originalName":"Mega Ampharos","form":null,"gender":null,"tier":"Mega Raids","isShadowRaid":false,"eventStatus":"ongoing","canBeShiny":true,"types":[{"name":"electric","image":"https://leekduck.com/assets/img/types/electric.png"},{"name":"dragon","image":"https://leekduck.com/assets/img/types/dragon.png"}],"combatPower":{"normal":{"min":1554,"max":1630},"boosted":{"min":1943,"max":2037}},"boostedWeather":[{"name":"rainy","image":"https://leekduck.com/assets/img/weather/rainy.png"}],"image":"https://cdn.leekduck.com/assets/img/pokemon_icons/pm181.fMEGA.icon.png","imageWidth":256,"imageHeight":256,"imageType":"png"},{"name":"Shadow Dratini","originalName":"Shadow Dratini","form":null,"gender":null,"tier":"1-Star Raids","isShadowRaid":true,"eventStatus":"unknown","canBeShiny":true,"types":[{"name":"dragon","image":"https://leekduck.com/assets/img/types/dragon.png"}],"combatPower":{"normal":{"min":495,"max":574},"boosted":{"min":618,"max":717}},"boostedWeather":[{"name":"windy","image":"https://leekduck.com/assets/img/weather/windy.png"}],"image":"https://cdn.leekduck.com/assets/img/pokemon_icons/pm147.icon.png","imageWidth":256,"imageHeight":256,"imageType":"png"},{"name":"Shadow Gligar","originalName":"Shadow Gligar","form":null,"gender":null,"tier":"1-Star Raids","isShadowRaid":true,"eventStatus":"unknown","canBeShiny":true,"types":[{"name":"ground","image":"https://leekduck.com/assets/img/types/ground.png"},{"name":"flying","image":"https://leekduck.com/assets/img/types/flying.png"}],"combatPower":{"normal":{"min":952,"max":1061},"boosted":{"min":1191,"max":1326}},"boostedWeather":[{"name":"sunny","image":"https://leekduck.com/assets/img/weather/sunny.png"},{"name":"windy","image":"https://leekduck.com/assets/img/weather/windy.png"}],"image":"https://cdn.leekduck.com/assets/img/pokemon_icons/pm207.icon.png","imageWidth":256,"imageHeight":256,"imageType":"png"},{"name":"Shadow Cacnea","originalName":"Shadow Cacnea","form":null,"gender":null,"tier":"1-Star Raids","isShadowRaid":true,"eventStatus":"unknown","canBeShiny":true,"types":[{"name":"grass","image":"https://leekduck.com/assets/img/types/grass.png"}],"combatPower":{"normal":{"min":618,"max":709},"boosted":{"min":773,"max":887}},"boostedWeather":[{"name":"sunny","image":"https://leekduck.com/assets/img/weather/sunny.png"}],"image":"https://cdn.leekduck.com/assets/img/pokemon_icons/pm331.icon.png","imageWidth":256,"imageHeight":256,"imageType":"png"},{"name":"Shadow Joltik","originalName":"Shadow Joltik","form":null,"gender":null,"tier":"1-Star Raids","isShadowRaid":true,"eventStatus":"unknown","canBeShiny":false,"types":[{"name":"bug","image":"https://leekduck.com/assets/img/types/bug.png"},{"name":"electric","image":"https://leekduck.com/assets/img/types/electric.png"}],"combatPower":{"normal":{"min":504,"max":584},"boosted":{"min":631,"max":730}},"boostedWeather":[{"name":"rainy","image":"https://leekduck.com/assets/img/weather/rainy.png"}],"image":"https://cdn.leekduck.com/assets/img/pokemon_icons/pm595.icon.png","imageWidth":256,"imageHeight":256,"imageType":"png"},{"name":"Shadow Alolan Marowak","originalName":"Shadow Alolan Marowak","form":null,"gender":null,"tier":"3-Star Raids","isShadowRaid":true,"eventStatus":"unknown","canBeShiny":false,"types":[{"name":"fire","image":"https://leekduck.com/assets/img/types/fire.png"},{"name":"ghost","image":"https://leekduck.com/assets/img/types/ghost.png"}],"combatPower":{"normal":{"min":941,"max":1048},"boosted":{"min":1176,"max":1311}},"boostedWeather":[{"name":"sunny","image":"https://leekduck.com/assets/img/weather/sunny.png"},{"name":"fog","image":"https://leekduck.com/assets/img/weather/foggy.png"}],"image":"https://cdn.leekduck.com/assets/img/pokemon_icons/pm105.fALOLA.icon.png","imageWidth":256,"imageHeight":256,"imageType":"png"},{"name":"Shadow Lapras","originalName":"Shadow Lapras","form":null,"gender":null,"tier":"3-Star Raids","isShadowRaid":true,"eventStatus":"unknown","canBeShiny":true,"types":[{"name":"water","image":"https://leekduck.com/assets/img/types/water.png"},{"name":"ice","image":"https://leekduck.com/assets/img/types/ice.png"}],"combatPower":{"normal":{"min":1377,"max":1509},"boosted":{"min":1721,"max":1886}},"boostedWeather":[{"name":"rainy","image":"https://leekduck.com/assets/img/weather/rainy.png"},{"name":"snow","image":"https://leekduck.com/assets/img/weather/snowy.png"}],"image":"https://cdn.leekduck.com/assets/img/pokemon_icons/pm131.icon.png","imageWidth":256,"imageHeight":256,"imageType":"png"},{"name":"Shadow Stantler","originalName":"Shadow Stantler","form":null,"gender":null,"tier":"3-Star Raids","isShadowRaid":true,"eventStatus":"unknown","canBeShiny":true,"types":[{"name":"normal","image":"https://leekduck.com/assets/img/types/normal.png"}],"combatPower":{"normal":{"min":1118,"max":1236},"boosted":{"min":1398,"max":1546}},"boostedWeather":[{"name":"partly cloudy","image":"https://leekduck.com/assets/img/weather/partlycloudy.png"}],"image":"https://cdn.leekduck.com/assets/img/pokemon_icons/pm234.icon.png","imageWidth":256,"imageHeight":256,"imageType":"png"},{"name":"Shadow Cresselia","origin